module,phase,name,code,sequence,workflow-file,command,required,agent-name,agent-command,agent-display-name,agent-title,options,description,output-location,outputs
core,anytime,Brainstorming,BSP,,_bmad/core/workflows/brainstorming/workflow.md,bmad-brainstorming,false,analyst,,,,,Generate diverse ideas through interactive techniques. Use early in ideation phase or when stuck generating ideas.,{output_folder}/brainstorming/brainstorming-session-{{date}}.md,
core,anytime,Party Mode,PM,,_bmad/core/workflows/party-mode/workflow.md,bmad-party-mode,false,party-mode facilitator,,,,,Orchestrate multi-agent discussions. Use when you need multiple agent perspectives or want agents to collaborate.,,
core,anytime,bmad-help,BH,,_bmad/core/tasks/help.md,bmad-help,false,,,,,,Get unstuck by showing what workflow steps come next or answering BMad Method questions.,,
core,anytime,Index Docs,ID,,_bmad/core/tasks/index-docs.xml,bmad-index-docs,false,,,,,,Create lightweight index for quick LLM scanning. Use when LLM needs to understand available docs without loading everything.,,
core,anytime,Shard Document,SD,,_bmad/core/tasks/shard-doc.xml,bmad-shard-doc,false,,,,,,Split large documents into smaller files by sections. Use when doc becomes too large (>500 lines) to manage effectively.,,
core,anytime,Editorial Review - Prose,EP,,_bmad/core/tasks/editorial-review-prose.xml,bmad-editorial-review-prose,false,,,,,,"Review prose for clarity, tone, and communication issues. Use after drafting to polish written content.",report located with target document,three-column markdown table with suggested fixes
core,anytime,Editorial Review - Structure,ES,,_bmad/core/tasks/editorial-review-structure.xml,bmad-editorial-review-structure,false,,,,,,"Propose cuts, reorganization, and simplification while preserving comprehension. Use when doc produced from multiple subprocesses or needs structural improvement.",report located with target document,
core,anytime,Adversarial Review (General),AR,,_bmad/core/tasks/review-adversarial-general.xml,bmad-review-adversarial-general,false,,,,,,"Review content critically to find issues and weaknesses. Use for quality assurance or before finalizing deliverables. Code Review in other modules run this automatically, but its useful also for document reviews",,
tea,0-learning,Teach Me Testing,TMT,10,_bmad/tea/workflows/testarch/teach-me-testing/workflow.md,bmad_tea_teach-me-testing,false,tea,bmad:UI automation:agent:tea,Murat,🧪 Master Test Architect and Quality Advisor,Create Mode,Teach testing fundamentals through 7 sessions (TEA Academy),test_artifacts,progress file|session notes|certificate
tea,3-solutioning,Test Framework,TF,10,_bmad/tea/workflows/testarch/framework/workflow.yaml,bmad_tea_framework,false,tea,bmad:UI automation:agent:tea,Murat,🧪 Master Test Architect and Quality Advisor,Create Mode,Initialize production-ready test framework,test_artifacts,framework scaffold
tea,3-solutioning,CI Setup,CI,20,_bmad/tea/workflows/testarch/ci/workflow.yaml,bmad_tea_ci,false,tea,bmad:UI automation:agent:tea,Murat,🧪 Master Test Architect and Quality Advisor,Create Mode,Configure CI/CD quality pipeline,test_artifacts,ci config
tea,3-solutioning,Test Design,TD,30,_bmad/tea/workflows/testarch/test-design/workflow.yaml,bmad_tea_test-design,false,tea,bmad:UI automation:agent:tea,Murat,🧪 Master Test Architect and Quality Advisor,Create Mode,Risk-based test planning,test_artifacts,test design document
tea,4-implementation,ATDD,AT,10,_bmad/tea/workflows/testarch/atdd/workflow.yaml,bmad_tea_atdd,false,tea,bmad:UI automation:agent:tea,Murat,🧪 Master Test Architect and Quality Advisor,Create Mode,Generate failing tests (TDD red phase),test_artifacts,atdd tests
tea,4-implementation,Test Automation,TA,20,_bmad/tea/workflows/testarch/automate/workflow.yaml,bmad_tea_automate,false,tea,bmad:UI automation:agent:tea,Murat,🧪 Master Test Architect and Quality Advisor,Create Mode,Expand test coverage,test_artifacts,test suite
tea,4-implementation,Test Review,RV,30,_bmad/tea/workflows/testarch/test-review/workflow.yaml,bmad_tea_test-review,false,tea,bmad:UI automation:agent:tea,Murat,🧪 Master Test Architect and Quality Advisor,Validate Mode,Quality audit (0-100 scoring),test_artifacts,review report
tea,4-implementation,NFR Assessment,NR,40,_bmad/tea/workflows/testarch/nfr-assess/workflow.yaml,bmad_tea_nfr-assess,false,tea,bmad:UI automation:agent:tea,Murat,🧪 Master Test Architect and Quality Advisor,Create Mode,Non-functional requirements,test_artifacts,nfr report
tea,4-implementation,Traceability,TR,50,_bmad/tea/workflows/testarch/trace/workflow.yaml,bmad_tea_trace,false,tea,bmad:UI automation:agent:tea,Murat,🧪 Master Test Architect and Quality Advisor,Create Mode,Coverage traceability and gate,test_artifacts,traceability matrix|gate decision